work_id,isbn13,asin,title,author,publication_year,publisher,language,pages,genres,tags,description,formats,physical_owned,kindle_owned,audiobook_owned,goodreads_id,goodreads_url,sources,date_added,date_read,date_updated,read_status,rating,reread,reread_count,dnf,dnf_reason,pacing_rating,tone,vibe,what_i_wanted,did_it_deliver,favorite_elements,pet_peeves,notes,anchor_type,would_recommend
,,,The Eyes of the Beholders (Star Trek: The Next Generation #13),A.C. Crispin,1990,Pocket Books,,243,,,,,0,0,0,217871,https://www.goodreads.com/book/show/217871,goodreads,2014-08-08,,2025-12-25,read,5,0,1,,,,,,,,,,,,
,,,"Genome (The Extinction Files, #2)",A.G. Riddle,2017,Legion Books,,544,,,,,0,0,0,34850181,https://www.goodreads.com/book/show/34850181,goodreads,2019-08-17,,2025-12-25,read,,0,1,,,,,,,,,,,,
,,,"Pandemic (The Extinction Files, #1)",A.G. Riddle,2017,Legion Books,,722,,,,,0,0,0,34811896,https://www.goodreads.com/book/show/34811896,goodreads,2019-08-14,,2025-12-25,read,,0,1,,,,,,,,,,,,
,,,"The Atlantis Gene (The Origin Mystery, #1)",A.G. Riddle,2013,Amazon Digital Services,,488,,,,,0,0,0,17999892,https://www.goodreads.com/book/show/17999892,goodreads,2014-08-08,,2025-12-25,read,4,0,1,,,,,,,,,,,,
,,,"The Lost Colony (The Long Winter, #3)",A.G. Riddle,2019,Legion Books,,380,,,,,0,0,0,50190168,https://www.goodreads.com/book/show/50190168,goodreads,2020-11-16,,2025-12-25,read,,0,1,,,,,,,,,,,,
,,,"The Solar War (The Long Winter, #2)",A.G. Riddle,2019,Legion,,470,,,,,0,0,0,49973863,https://www.goodreads.com/book/show/49973863,goodreads,2019-08-13,,2025-12-25,read,,0,1,,,,,,,,,,,,
,,,"Winter World (The Long Winter, #1)",A.G. Riddle,2019,Legion Books,,472,,,,,0,0,0,43720168,https://www.goodreads.com/book/show/43720168,goodreads,2019-08-11,,2025-12-25,read,,0,1,,,,,,,,,,,,
,,,The Library of the Unwritten (Hell's Library #1),A.J. Hackwith,2019,Ace,,382,,,,,0,0,0,44157462,https://www.goodreads.com/book/show/44157462,goodreads,2020-06-23,,2025-12-25,reading,,0,1,,,,,,,,,,,,
,,,Behind the Throne: A Domestic History of the British Royal Household,Adrian Tinniswood,2018,Basic Books,,384,,,,,0,0,0,38610135,https://www.goodreads.com/book/show/38610135,goodreads,2020-11-16,,2025-12-25,read,,0,1,,,,,,,,,,,,
,,,Grenade,Alan Gratz,2018,Scholastic Press,,293,,,,,0,0,0,39193893,https://www.goodreads.com/book/show/39193893,goodreads,2020-02-01,,2025-12-25,read,,0,1,,,,,,,,,,,,
,,,"Blue Remembered Earth (Poseidon's Children, #1)",Alastair Reynolds,2012,Ace,,505,,,,,0,0,0,18139005,https://www.goodreads.com/book/show/18139005,goodreads,2018-07-02,,2025-12-25,read,,0,1,,,,,,,,,,,,
,,,The Dictionary of Imaginary Places: The Newly Updated and Expanded Classic,Alberto Manguel,2000,Mariner Books,,776,,,,,0,0,0,53086,https://www.goodreads.com/book/show/53086,goodreads,2014-08-08,,2025-12-25,read,4,0,1,,,,,,,,,,,,
,,,Brave New World,Aldous Huxley,1998,HarperPerennial / Perennial Classics,,288,,,,,0,0,0,5129,https://www.goodreads.com/book/show/5129,goodreads,2012-01-23,,2025-12-25,read,4,0,1,,,,,,,,,,,,
,,,"Half Baked: The Story of My Nerves, My Newborn, and How We Both Learned to Breathe",Alexa Stevenson,2010,,,306,,,,,0,0,0,9346967,https://www.goodreads.com/book/show/9346967,goodreads,2014-08-08,,2025-12-25,read,4,0,1,,,,,,,,,,,,
,,,Pacific Rim: The Official Movie Novelization,Alexander C. Irvine,2013,Titan Books,,352,,,,,0,0,0,20514377,https://www.goodreads.com/book/show/20514377,goodreads,2014-08-08,,2025-12-25,read,3,0,1,,,,,,,,,,,,
,,,"Her Knight's Quest (Warriors of the Mist, #2)",Alexis Morgan,2013,Signet,,336,,,,,0,0,0,20154264,https://www.goodreads.com/book/show/20154264,goodreads,2014-08-08,,2025-12-25,read,4,0,1,,,,,,,,,,,,
,,,"My Lady Mage (Warriors of the Mist, #1)",Alexis Morgan,2012,Signet,,336,,,,,0,0,0,15733828,https://www.goodreads.com/book/show/15733828,goodreads,2014-08-08,,2025-12-25,read,4,0,1,,,,,,,,,,,,
,,,"The House of Shattered Wings (Dominion of the Fallen, #1)",Aliette de Bodard,2015,Gollancz,,402,,,,,0,0,0,23601046,https://www.goodreads.com/book/show/23601046,goodreads,2018-07-02,,2025-12-25,want_to_read,,0,0,,,,,,,,,,,,
,,,Arkwright,Allen M. Steele,2016,Tor Books,,336,,,,,0,0,0,25659450,https://www.goodreads.com/book/show/25659450,goodreads,2018-07-02,,2025-12-25,want_to_read,,0,0,,,,,,,,,,,,
,,,"Matched (Matched, #1)",Ally Condie,2011,Speak,,418,,,,,0,0,0,12359568,https://www.goodreads.com/book/show/12359568,goodreads,2014-08-08,,2025-12-25,read,4,0,1,,,,,,,,,,,,
,,,"Ascend (Trylle, #3)",Amanda Hocking,2011,,,326,,,,,0,0,0,10203031,https://www.goodreads.com/book/show/10203031,goodreads,2014-08-08,,2025-12-25,read,4,0,1,,,,,,,,,,,,
,,,Switched (Trylle Trilogy #1),Amanda Hocking,2010,,,315,,,,,0,0,0,8678711,https://www.goodreads.com/book/show/8678711,goodreads,2014-08-08,,2025-12-25,read,3,0,1,,,,,,,,,,,,
,,,Torn (Trylle #2),Amanda Hocking,2010,St. Martin's Griffin,,377,,,,,0,0,0,9708400,https://www.goodreads.com/book/show/9708400,goodreads,2014-08-08,,2025-12-25,read,3,0,1,,,,,,,,,,,,
,,,"Glow (Sky Chasers, #1)",Amy Kathleen Ryan,2011,St. Martin's Griffin,,307,,,,,0,0,0,10174795,https://www.goodreads.com/book/show/10174795,goodreads,2012-01-23,,2025-12-25,read,4,0,1,,,,,,,,,,"My Review: http://lialexis.com/2012/01/19/review-glow-by-amy-kathleen-ryan/<br/><br/>I just finished reading Glow by Amy Kathleen Ryan, and my first reaction was somewhere between “Meh” and “Wow!”. I originally added it to my TBR list because it had an absolutely gorgeous cover, it would fit in with the 2012 Science Fiction Experiment over at Stainless Steel Droppings, and because the reviews of it are all over the map.  Yes, I specifically picked up this book because the reviews don’t agree.  It’s not just a love it/hate it thing either, this one has opinions all across the spectrum, so I thought I’d give it a whirl.  I mean, look at that cover art people, really!<br/><br/>The premise of the story is the relationship between Kieran and Waverly.  They’re the two eldest children of their generation aboard the colony ship Empyrean. Ahead of their ship by a year, or so they think, is the New Horizon, led by overly religious crazy person Anne Mather, the primary antagonist of the novel.  When the Empyrean and it’s crew somehow meet up with New Horizon in the middle of a nebula hijinks ensue, and a significant portion of Empyrean’s crew, including all the girls, are captured and taken aboard New Horizon. The adult crew left aboard Empyrean is incapacitated or dead, so Kieran ends up fighting for the command that was always intended to be his, while Waverly is stuck aboard New Horizon fighting for her freedom.<br/><br/>Overall it’s an innovative story idea with a number of elements, that when combined, could have created something dramatic and compelling.  For the most part I think they all did. First off, Ryan’s amazing talent with characterization; she whips your loyalties back and forth between characters masterfully.  I’m not 100% sold on Waverly, but I can sympathize with her plight.  It’s the secondary characters that almost seem more alive, and there are a number of them who I found myself rooting for and then against within the space of a few pages.<br/><br/>I had read several recent reviews that indicated the plot would be slow going for the first half and then pick up, which I definitely found to be true. Additionally, I liked the interplay of freedom vs. oppression as a theme.  Issues surrounding pregnancy and freedom of choice as well as violence within faith were raised. I appreciated how these issues were tackled within what is ostensibly a YA novel, as well as how open-minded I felt that that author remained. The only thing YA about this book, in my opinion, was the teenage main characters.  One could easily insert twenty-somethings into the roles of Kieran and Waverly and get the same result, except that it would be sold as adult sci-fi rather than YA.<br/><br/>This was, I hate to even say it, another gosh darn cliffhanger of an ending, but thankfully was not done in such a way that I feel cornered into buying the next books.  Ryan did a good job of tying off the major plot lines so that I could walk away right now not knowing everything, but being satisfied that I know enough.<br/><br/>TL/DR: I didn’t love Glow, but it was a satisfying read, and I’m looking forward to the sequels to discover both how the story resolves and how the author evolves.",,
,,,"The Elvenbane (Halfblood Chronicles, #1)",Andre Norton,1993,Tor Books,,566,,,,,0,0,0,176892,https://www.goodreads.com/book/show/176892,goodreads,2014-08-08,,2025-12-25,want_to_read,,0,0,,,,,,,,,,,,
,,,Artemis,Andy Weir,2017,Crown,,305,,,,,0,0,0,34928122,https://www.goodreads.com/book/show/34928122,goodreads,2018-02-05,,2025-12-25,read,,0,1,,,,,,,,,,,,
,,,Project Hail Mary,Andy Weir,2021,Ballantine Books,,549,,,,,0,0,0,54906250,https://www.goodreads.com/book/show/54906250,goodreads,2021-05-06,,2025-12-25,reading,4,1,2,,,,,,,,,,,,
,,,"Randomize (Forward Collection, #6)",Andy Weir,2019,Amazon Original Stories,,28,,,,,0,0,0,49661162,https://www.goodreads.com/book/show/49661162,goodreads,2021-06-06,,2025-12-25,read,,0,1,,,,,,,,,,,,
,,,The Care and Feeding of Ravenously Hungry Girls,Anissa Gray,2019,Berkley,,294,,,,,0,0,0,39719167,https://www.goodreads.com/book/show/39719167,goodreads,2019-01-03,,2025-12-25,want_to_read,,0,0,,,,,,,,,,,,
,,,"Ancillary Mercy (Imperial Radch, #3)",Ann Leckie,2015,Orbit,,363,,,,,0,0,0,24966740,https://www.goodreads.com/book/show/24966740,goodreads,2025-09-14,,2025-12-25,reading,,0,1,,,,,,,,,,,,
,,,"Ancillary Sword (Imperial Radch, #2)",Ann Leckie,2014,Orbit,,400,,,,,0,0,0,20944489,https://www.goodreads.com/book/show/20944489,goodreads,2025-09-08,,2025-12-25,read,,0,1,,,,,,,,,,,,
,,,The Raven Tower,Ann Leckie,2019,Orbit,,465,,,,,0,0,0,55578956,https://www.goodreads.com/book/show/55578956,goodreads,2025-09-28,,2025-12-25,reading,,0,1,,,,,,,,,,,,
,,,Black Beauty,Anna Sewell,1877,Public Domain Books,,216,,,,,0,0,0,6011735,https://www.goodreads.com/book/show/6011735,goodreads,2014-08-08,,2025-12-25,read,5,0,1,,,,,,,,,,,,
,,,"Etched in Bone (The Others, #5)",Anne Bishop,2017,Roc,,407,,,,,0,0,0,30749074,https://www.goodreads.com/book/show/30749074,goodreads,2018-08-02,,2025-12-25,read,,0,1,,,,,,,,,,,,
,,,"Lake Silence (The World of the Others, #1; The Others, #6)",Anne Bishop,2018,Ace,,414,,,,,0,0,0,35407735,https://www.goodreads.com/book/show/35407735,goodreads,2018-07-17,,2025-12-25,read,4,0,1,,,,,,,,,,,,
,,,"Marked in Flesh (The Others, #4)",Anne Bishop,2016,Roc,,416,,,,,0,0,0,25700011,https://www.goodreads.com/book/show/25700011,goodreads,2018-07-30,,2025-12-25,read,,0,1,,,,,,,,,,,,
,,,"Murder of Crows (The Others, #2)",Anne Bishop,2014,Roc,,370,,,,,0,0,0,17563080,https://www.goodreads.com/book/show/17563080,goodreads,2018-07-29,,2025-12-25,read,,0,1,,,,,,,,,,,,
,,,"Vision in Silver (The Others, #3)",Anne Bishop,2015,Roc,,407,,,,,0,0,0,22456990,https://www.goodreads.com/book/show/22456990,goodreads,2018-07-29,,2025-12-25,read,,0,1,,,,,,,,,,,,
,,,"Written in Red (The Others, #1)",Anne Bishop,2013,Roc,,514,,,,,0,0,0,15989350,https://www.goodreads.com/book/show/15989350,goodreads,2018-07-29,,2025-12-25,read,,0,1,,,,,,,,,,,,
,,,"Dragonflight (Dragonriders of Pern, #1)",Anne McCaffrey,2005,Del Rey,,299,,,,,0,0,0,61975,https://www.goodreads.com/book/show/61975,goodreads,2014-10-12,,2025-12-25,want_to_read,,0,0,,,,,,,,,,,,
,,,Kitchen Confidential: Adventures in the Culinary Underbelly,Anthony Bourdain,2008,Bloomsbury USA,,321,,,,,0,0,0,8161568,https://www.goodreads.com/book/show/8161568,goodreads,2014-08-08,,2025-12-25,read,4,0,1,,,,,,,,,,,,
,,,A Clockwork Orange,Anthony Burgess,1986,W. W. Norton & Company,,192,,,,,0,0,0,227463,https://www.goodreads.com/book/show/227463,goodreads,2012-01-23,,2025-12-25,read,2,0,1,,,,,,,,,,,,
,,,Blood Rock (Skindancer #2),Anthony Francis,2011,Bell Bridge Books,,298,,,,,0,0,0,12362699,https://www.goodreads.com/book/show/12362699,goodreads,2014-08-08,,2025-12-25,read,5,0,1,,,,,,,,,,,,
,,,"Frost Moon (Skindancer, #1)",Anthony Francis,2010,BelleBooks - A,,284,,,,,0,0,0,8146203,https://www.goodreads.com/book/show/8146203,goodreads,2014-08-08,,2025-12-25,read,5,0,1,,,,,,,,,,,,
,,,The Saltwater Curse,Avina St. Graves,2025,,,384,,,,,0,0,0,223432841,https://www.goodreads.com/book/show/223432841,goodreads,2025-10-05,,2025-12-25,reading,,0,1,,,,,,,,,,,,
,,,A Year of Writing Dangerously: 365 Days of Inspiration and Encouragement,Barbara Abercrombie,2012,New World Library,,408,,,,,0,0,0,13239378,https://www.goodreads.com/book/show/13239378,goodreads,2014-08-08,,2025-12-25,read,4,0,1,,,,,,,,,,,,
,,,Civil War Women,Barbara Brackman,2000,,,128,,,,,0,0,0,13028956,https://www.goodreads.com/book/show/13028956,goodreads,2018-12-28,,2025-12-25,read,,0,1,,,,,,,,,,,,
,,,"A Closed and Common Orbit (Wayfarers, #2)",Becky Chambers,2016,Harper Voyager,,365,,,,,0,0,0,29808780,https://www.goodreads.com/book/show/29808780,goodreads,2019-02-10,,2025-12-25,read,,0,1,,,,,,,,,,,,
,,,"Record of a Spaceborn Few (Wayfarers, #3)",Becky Chambers,2018,Harper Voyager,,368,,,,,0,0,0,36278177,https://www.goodreads.com/book/show/36278177,goodreads,2019-02-18,,2025-12-25,read,,0,1,,,,,,,,,,,,
,,,"The Galaxy, and the Ground Within (Wayfarers, #4)",Becky Chambers,2021,Harper Voyager,,336,,,,,0,0,0,53441154,https://www.goodreads.com/book/show/53441154,goodreads,2021-03-15,,2025-12-25,want_to_read,,0,0,,,,,,,,,,,,
,,,"The Long Way to a Small, Angry Planet (Wayfarers, #1)",Becky Chambers,2015,Harper Voyager,,423,,,,,0,0,0,26042767,https://www.goodreads.com/book/show/26042767,goodreads,2019-02-09,,2025-12-25,read,5,1,2,,,,,,,,,,,,
,,,"A Million Suns (Across the Universe, #2)",Beth Revis,2012,Razorbill,,386,,,,,0,0,0,10345927,https://www.goodreads.com/book/show/10345927,goodreads,2012-01-23,,2025-12-25,read,5,0,1,,,,,,,,,,,,
,,,"Across the Universe (Across the Universe, #1)",Beth Revis,2011,Razorbill,,399,,,,,0,0,0,8235178,https://www.goodreads.com/book/show/8235178,goodreads,2012-01-23,,2025-12-25,read,5,0,1,,,,,,,,,,,,
,,,"Shades of Earth (Across the Universe, #3)",Beth Revis,2013,Razorbill,,383,,,,,0,0,0,17252473,https://www.goodreads.com/book/show/17252473,goodreads,2014-08-08,,2025-12-25,read,4,0,1,,,,,,,,,,,,
,,,"A Song Below Water (A Song Below Water, #1)",Bethany C. Morrow,2020,Tor Teen,,302,,,,,0,0,0,48510857,https://www.goodreads.com/book/show/48510857,goodreads,2020-08-05,,2025-12-25,read,,0,1,,,,,,,,,,,,
,,,Chains of Command,Bill McCay,1992,Pocket Books,,278,,,,,0,0,0,217877,https://www.goodreads.com/book/show/217877,goodreads,2014-08-08,,2025-12-25,read,5,0,1,,,,,,,,,,,,
,,,"Depths of Vanalf (Grimnir Chronicles, #1)",Brady Hunsaker,2025,,,446,,,,,0,0,0,222953258,https://www.goodreads.com/book/show/222953258,goodreads,2025-10-29,,2025-12-25,reading,,0,1,,,,,,,,,,,,
,,,"Mistborn: The Final Empire (Mistborn, #1)",Brandon Sanderson,2006,Tor Books,,541,,,,,0,0,0,68428,https://www.goodreads.com/book/show/68428,goodreads,2012-01-23,,2025-12-25,read,5,0,1,,,,,,,,,,,,
,,,"Oathbringer (The Stormlight Archive, #3)",Brandon Sanderson,2017,Tor Books,,1220,,,,,0,0,0,34039808,https://www.goodreads.com/book/show/34039808,goodreads,2020-10-18,,2025-12-25,read,,0,1,,,,,,,,,,,,
,,,"Words of Radiance (The Stormlight Archive, #2)",Brandon Sanderson,2014,Tor Books,,1088,,,,,0,0,0,20150777,https://www.goodreads.com/book/show/20150777,goodreads,2020-04-03,,2025-12-25,read,,0,1,,,,,,,,,,,,
,,,"House Atreides (Prelude to Dune, #1)",Brian Herbert,2010,,,,,,,,0,0,0,6623589,https://www.goodreads.com/book/show/6623589,goodreads,2021-10-26,,2025-12-25,read,,0,1,,,,,,,,,,,,
,,,"Foreigner (Foreigner, #1)",C.J. Cherryh,2004,DAW,,431,,,,,0,0,0,13274939,https://www.goodreads.com/book/show/13274939,goodreads,2018-01-04,,2025-12-25,read,4,0,1,,,,,,,,,,,,
,,,Letters for Emily,Camron Wright,2002,Atria,,224,,,,,0,0,0,1236230,https://www.goodreads.com/book/show/1236230,goodreads,2014-08-08,,2025-12-25,read,3,0,1,,,,,,,,,,,,
,,,"Birthmarked (Birthmarked, #1)",Caragh M. O'Brien,2010,Roaring Brook Press,,361,,,,,0,0,0,6909544,https://www.goodreads.com/book/show/6909544,goodreads,2012-01-23,,2025-12-25,read,5,0,1,,,,,,,,,,,,
,,,"Prized (Birthmarked, #2)",Caragh M. O'Brien,2011,Roaring Brook Press,,366,,,,,0,0,0,12636081,https://www.goodreads.com/book/show/12636081,goodreads,2014-08-08,,2025-12-25,read,4,0,1,,,,,,,,,,,,
,,,"Promised (Birthmarked, #3)",Caragh M. O'Brien,2012,Roaring Brook Press,,304,,,,,0,0,0,13565580,https://www.goodreads.com/book/show/13565580,goodreads,2014-08-08,,2025-12-25,read,4,0,1,,,,,,,,,,,,
,,,"The Ashes & the Star-Cursed King (Crowns of Nyaxia, #2)",Carissa Broadbent,2023,,,626,,,,,0,0,0,62335396,https://www.goodreads.com/book/show/62335396,goodreads,2025-04-24,,2025-12-25,read,,0,1,,,,,,,,,,,,
,,,"The Serpent and the Wings of Night (Crowns of Nyaxia, #1)",Carissa Broadbent,2022,Independently Published,,504,,,,,0,0,0,60714999,https://www.goodreads.com/book/show/60714999,goodreads,2025-04-22,,2025-12-25,reading,,0,1,,,,,,,,,,,,
,,,Doomsday World,Carmen Carter,1991,Pocket Books,,276,,,,,0,0,0,422958,https://www.goodreads.com/book/show/422958,goodreads,2014-08-08,,2025-12-25,read,5,0,1,,,,,,,,,,,,
,,,The Children of Hamlin (Star Trek: The Next Generation #3),Carmen Carter,1988,Pocket Books,,252,,,,,0,0,0,217838,https://www.goodreads.com/book/show/217838,goodreads,2014-08-08,,2025-12-25,read,5,0,1,,,,,,,,,,,,
,,,"Decked (Regan Reilly Mysteries, #1)",Carol Higgins Clark,1992,,,246,,,,,0,0,0,8153899,https://www.goodreads.com/book/show/8153899,goodreads,2023-06-20,,2025-12-25,read,3,0,1,,,,,,,,,,,,
,,,"What Remains: A Memoir of Fate, Friendship, and Love",Carole Radziwill,2005,,,416,,,,,0,0,0,8256440,https://www.goodreads.com/book/show/8256440,goodreads,2014-08-08,,2025-12-25,read,4,0,1,,,,,,,,,,,,
,,,"The Awakening (Zodiac Academy, #1)",Caroline Peckham,2019,Dark Ink Publishing,,420,,,,,0,0,0,219527732,https://www.goodreads.com/book/show/219527732,goodreads,2025-01-06,,2025-12-25,reading,,0,1,,,,,,,,,,,,
,,,The Dogs of Babel,Carolyn Parkhurst,2004,Back Bay Books,,278,,,,,0,0,0,89691,https://www.goodreads.com/book/show/89691,goodreads,2014-08-08,,2025-12-25,read,4,0,1,,,,,,,,,,,,
,,,"The Forest of Hands and Teeth (The Forest of Hands and Teeth, #1)",Carrie Ryan,2009,Gollancz,,336,,,,,0,0,0,3432478,https://www.goodreads.com/book/show/3432478,goodreads,2018-07-02,,2025-12-25,want_to_read,,0,0,,,,,,,,,,,,
,,,"City of Ashes (The Mortal Instruments, #2)",Cassandra Clare,2009,Margaret K. McElderry Books,,513,,,,,0,0,0,6443015,https://www.goodreads.com/book/show/6443015,goodreads,2014-08-08,,2025-12-25,read,4,0,1,,,,,,,,,,,,
,,,"City of Bones (The Mortal Instruments, #1)",Cassandra Clare,2009,Margaret K. McElderry Books,,485,,,,,0,0,0,7541858,https://www.goodreads.com/book/show/7541858,goodreads,2014-08-08,,2025-12-25,read,5,0,1,,,,,,,,,,,,
,,,"City of Glass (The Mortal Instruments, #3)",Cassandra Clare,2009,Margaret K. McElderry Books,,561,,,,,0,0,0,7314503,https://www.goodreads.com/book/show/7314503,goodreads,2014-08-08,,2025-12-25,read,4,0,1,,,,,,,,,,,,
,,,"Clockwork Angel (The Infernal Devices, #1)",Cassandra Clare,2010,Margaret K. McElderry Books,,479,,,,,0,0,0,7171637,https://www.goodreads.com/book/show/7171637,goodreads,2012-01-23,,2025-12-25,want_to_read,,0,0,,,,,,,,,,,,
,,,Blood Song (Blood Singer #1),Cat Adams,2010,Tor Books,,372,,,,,0,0,0,8504582,https://www.goodreads.com/book/show/8504582,goodreads,2014-08-08,,2025-12-25,read,3,0,1,,,,,,,,,,,,
,,,"The Dark City (Relic Master, #1)",Catherine Fisher,2011,DIAL,,383,,,,,0,0,0,11882304,https://www.goodreads.com/book/show/11882304,goodreads,2014-08-08,,2025-12-25,read,3,0,1,,,,,,,,,,,,
,,,Jane Eyre,Charlotte Brontë,2003,Penguin,,532,,,,,0,0,0,10210,https://www.goodreads.com/book/show/10210,goodreads,2012-01-23,,2025-12-25,read,4,0,1,,,,,,,,,,,,
,,,"Battle of Betazed, The (Star Trek: The Next Generation)",Charlotte Douglas,2002,,,304,,,,,0,0,0,11279064,https://www.goodreads.com/book/show/11279064,goodreads,2014-08-08,,2025-12-25,read,5,0,1,,,,,,,,,,,,
,,,Children of the Fog,Cheryl Kaye Tardif,2011,Imajin Books,,279,,,,,0,0,0,10922889,https://www.goodreads.com/book/show/10922889,goodreads,2014-08-08,,2025-12-25,read,4,0,1,,,,,,,,,,,,
,,,An Astronaut's Guide to Life on Earth,Chris Hadfield,2013,"Little, Brown and Company",,322,,,,,0,0,0,18815082,https://www.goodreads.com/book/show/18815082,goodreads,2014-08-08,,2025-12-25,read,5,0,1,,,,,,,,,,,,
,,,Cravings: Hungry for More,Chrissy Teigen,2018,Clarkson Potter,,256,,,,,0,0,0,40004097,https://www.goodreads.com/book/show/40004097,goodreads,2019-01-03,,2025-12-25,read,,0,1,,,,,,,,,,,,
,,,Homecoming (Star Trek: Voyager—Homecoming #1),Christie Golden,2003,Pocket Books/Star Trek,,262,,,,,0,0,0,19718594,https://www.goodreads.com/book/show/19718594,goodreads,2014-08-08,,2025-12-25,read,5,0,1,,,,,,,,,,,,
,,,The Farther Shore (Star Trek: Voyager—Homecoming #2),Christie Golden,2003,Pocket Books/Star Trek,,275,,,,,0,0,0,19606621,https://www.goodreads.com/book/show/19606621,goodreads,2014-08-08,,2025-12-25,read,5,0,1,,,,,,,,,,,,
,,,"The Shattering: Prelude to Cataclysm (World of Warcraft, #8)",Christie Golden,2010,Pocket Books,,357,,,,,0,0,0,20105391,https://www.goodreads.com/book/show/20105391,goodreads,2014-08-08,,2025-12-25,read,3,0,1,,,,,,,,,,,,
,,,World of Warcraft: Jaina Proudmoore: Tides of War,Christie Golden,2012,Pocket Books,,354,,,,,0,0,0,19678478,https://www.goodreads.com/book/show/19678478,goodreads,2014-08-08,,2025-12-25,read,3,0,1,,,,,,,,,,,,
,,,"Orion's Hounds (Star Trek: Titan, #3)",Christopher L. Bennett,2006,,,400,,,,,0,0,0,6422366,https://www.goodreads.com/book/show/6422366,goodreads,2024-05-04,,2025-12-25,read,,0,1,,,,,,,,,,,,
,,,"Over a Torrent Sea (Star Trek: Titan, #5)",Christopher L. Bennett,2009,,,370,,,,,0,0,0,8508926,https://www.goodreads.com/book/show/8508926,goodreads,2024-05-12,,2025-12-25,read,,0,1,,,,,,,,,,,,
,,,The Struggle Within (Star Trek: Typhon Pact #5),Christopher L. Bennett,2011,Pocket Books/Star Trek,,103,,,,,0,0,0,20097778,https://www.goodreads.com/book/show/20097778,goodreads,2014-08-08,,2025-12-25,read,5,0,1,,,,,,,,,,,,
,,,Watching the Clock (Star Trek: Department of Temporal Investigations #1),Christopher L. Bennett,2011,Pocket Books,,496,,,,,0,0,0,9037520,https://www.goodreads.com/book/show/9037520,goodreads,2014-08-08,,2025-12-25,want_to_read,,0,0,,,,,,,,,,,,
,,,"Red Dice (The Last Vampire, #3)",Christopher Pike,1995,Pocket Books,,208,,,,,0,0,0,137970,https://www.goodreads.com/book/show/137970,goodreads,2014-08-08,,2025-12-25,read,4,0,1,,,,,,,,,,,,
,,,"Remember Me 3: The Last Story (Remember Me, #3)",Christopher Pike,1995,Simon Pulse,,256,,,,,0,0,0,1103889,https://www.goodreads.com/book/show/1103889,goodreads,2014-08-08,,2025-12-25,read,4,0,1,,,,,,,,,,,,
,,,"The Last Vampire (The Last Vampire, #1)",Christopher Pike,1994,Pocket Books,,208,,,,,0,0,0,771710,https://www.goodreads.com/book/show/771710,goodreads,2014-08-08,,2025-12-25,read,4,0,1,,,,,,,,,,,,
,,,Still Me,Christopher Reeve,1998,Random House,,309,,,,,0,0,0,2018856,https://www.goodreads.com/book/show/2018856,goodreads,2014-08-08,,2025-12-25,read,4,0,1,,,,,,,,,,,,
,,,The Aquariums of Pyongyang: Ten Years in the North Korean Gulag,Chʻŏr-hwan  Kang,2000,,,266,,,,,0,0,0,12142155,https://www.goodreads.com/book/show/12142155,goodreads,2014-08-08,,2025-12-25,read,4,0,1,,,,,,,,,,,,
,,,"The Demon King (Seven Realms, #1)",Cinda Williams Chima,2009,Hyperion Disney Book Group,,524,,,,,0,0,0,8161186,https://www.goodreads.com/book/show/8161186,goodreads,2014-08-08,,2025-12-25,read,4,0,1,,,,,,,,,,,,
,,,"The Exiled Queen (Seven Realms, #2)",Cinda Williams Chima,2010,Disney-Hyperion,,592,,,,,0,0,0,8685170,https://www.goodreads.com/book/show/8685170,goodreads,2014-08-08,,2025-12-25,read,4,0,1,,,,,,,,,,,,
,,,"Black Wind (Dirk Pitt, #18)",Clive Cussler,2004,G.P. Putnam's Sons,,530,,,,,0,0,0,459072,https://www.goodreads.com/book/show/459072,goodreads,2014-08-08,,2025-12-25,read,3,0,1,,,,,,,,,,,,
,,,"Sahara (Dirk Pitt, #11)",Clive Cussler,2004,Debolsillo,,649,,,,,0,0,0,41716,https://www.goodreads.com/book/show/41716,goodreads,2012-01-23,,2025-12-25,read,3,0,1,,,,,,,,,,,,
,,,"Trojan Odyssey (Dirk Pitt, #17)",Clive Cussler,2003,Putnam Adult,,496,,,,,0,0,0,1000089,https://www.goodreads.com/book/show/1000089,goodreads,2014-08-08,,2025-12-25,read,3,0,1,,,,,,,,,,,,
,,,Verity,Colleen Hoover,2018,"Hoover Ink, Inc.",,324,,,,,0,0,0,41957126,https://www.goodreads.com/book/show/41957126,goodreads,2021-08-27,,2025-12-25,read,,0,1,,,,,,,,,,,,
,,,Zone One,Colson Whitehead,2011,Anchor,,338,,,,,0,0,0,11501957,https://www.goodreads.com/book/show/11501957,goodreads,2014-08-08,,2025-12-25,read,4,0,1,,,,,,,,,,,,
,,,"To Say Nothing of the Dog (Oxford Time Travel, #2)",Connie Willis,1998,Bantam Books,,493,,,,,0,0,0,77773,https://www.goodreads.com/book/show/77773,goodreads,2014-08-08,,2025-12-25,read,3,0,1,,,,,,,,,,,,
,,,"Inkheart (Inkworld, #1)",Cornelia Funke,2005,Scholastic Paperbacks,,563,,,,,0,0,0,28194,https://www.goodreads.com/book/show/28194,goodreads,2012-01-23,,2025-12-25,read,5,0,1,,,,,,,,,,,,
,,,"The Forever Life (The Forever, #1)",Craig    Robertson,2016,Imagine-It Publishing,,254,,,,,0,0,0,29472673,https://www.goodreads.com/book/show/29472673,goodreads,2025-04-05,,2025-12-25,reading,,0,1,,,,,,,,,,,,
,,,"The Infection (The Infection, #1)",Craig DiLouie,2011,Permuted Press,,288,,,,,0,0,0,10345761,https://www.goodreads.com/book/show/10345761,goodreads,2014-08-08,,2025-12-25,read,4,0,1,,,,,,,,,,,,
,,,"Gourmet Game Night: Bite-Sized, Mess-Free Eating for Board-Game Parties, Bridge Clubs, Poker Nights, Book Groups, and More",Cynthia C. Nims,2010,Ten Speed Press,,160,,,,,0,0,0,6747415,https://www.goodreads.com/book/show/6747415,goodreads,2019-01-03,,2025-12-25,want_to_read,,0,0,,,,,,,,,,,,
